platform,title,company,location,url,date,description,source_api,id,relevance_score,salary,posted_time
Barclays,Software Engineer - Developer Experience,Barclays,Bengaluru,https://search.jobs.barclays/job/bengaluru/software-engineer-developer-experience/13015/93764357168,2026-04-22,"Join us as a Software Engineer - Developer Experience at Barclays, where you'll spearhead the evolution of our digital landscape, driving innovation and excellence. You'll harness cutting-edge technology to revolutionize our digital offerings, ensuring unapparelled customer experiences. The ideal candidate will have deep expertise in cloud-native technologies, distributed streaming platforms, Kubernetes orchestration, and multi-region architecture patterns.

To be a successful Software Engineer ",RapidAPI JSearch,f63c1f02,0.0,Not specified,2026-04-08T00:00:00.000Z
Uber,software engineer 2 iOS,Uber,Bengaluru,https://www.uber.com/global/en/careers/list/156527/,2026-04-22,"About the Role

This role is for experience team under earner org. The primary objective for this team is to solve the problem of low acceptance rate throughout uber systems. Uber has moved from a supply constrained market to ‘quality supply’ being need of the hour. The broader program enables uber to do just that by creating sustainable and meaningful quality based loyalty and engagement boosting products.

Core experiences like trip , offer , preferences scheduling planning and guidance are al",RapidAPI JSearch,4991250e,0.0,Not specified,2026-03-31T00:00:00.000Z
